{
  "$schema": "https://json-schema.org/draft/2020-12/schema",
  "$id": "cockpit-pipeline/runtime-contract.schema.json",
  "title": "Agent 2 runtime contract gate",
  "type": "object",
  "additionalProperties": false,
  "required": [
    "gate",
    "artifactId",
    "createdAt",
    "sceneGroup",
    "assetPath",
    "rootObject",
    "runtimeNodes",
    "customPropertiesPreserved",
    "reimportValidation",
    "scaleAndCameraAssumptions",
    "knownReferenceDeviations"
  ],
  "properties": {
    "gate": { "type": "string", "enum": ["runtime-contract"] },
    "artifactId": { "type": "string", "minLength": 1 },
    "createdAt": { "type": "string", "minLength": 1 },
    "sceneGroup": { "type": "string", "minLength": 1 },
    "assetPath": { "type": "string", "minLength": 1 },
    "rootObject": { "type": "string", "minLength": 1 },
    "runtimeNodes": {
      "type": "array",
      "minItems": 1,
      "items": {
        "type": "object",
        "additionalProperties": false,
        "required": ["name", "gameId", "pivotVerified", "localAxis", "htmlEquivalent"],
        "properties": {
          "name": { "type": "string", "minLength": 1 },
          "gameId": { "type": "string", "minLength": 1 },
          "pivotVerified": { "type": "boolean" },
          "pivotExportVerified": { "type": "boolean" },
          "nodeRole": { "type": "string", "enum": ["pivot", "collider", "cue"] },
          "visualAlignmentStatus": { "type": "string", "minLength": 1 },
          "localAxis": { "type": "string", "minLength": 1 },
          "htmlEquivalent": { "type": "string", "minLength": 1 }
        }
      }
    },
    "customPropertiesPreserved": { "type": "boolean" },
    "reimportValidation": { "type": "string", "enum": ["pass", "blocked", "fail"] },
    "visualAlignmentValidation": {
      "type": "object",
      "additionalProperties": false,
      "required": ["status", "evidence"],
      "properties": {
        "status": { "type": "string", "enum": ["not-verified", "verified", "blocked"] },
        "evidence": { "type": "string", "minLength": 1 }
      }
    },
    "scaleAndCameraAssumptions": { "type": "string", "minLength": 1 },
    "knownReferenceDeviations": {
      "type": "array",
      "items": { "type": "string", "minLength": 1 }
    }
  }
}
